{
  "schema_version": 3,
  "status": "approved",
  "catalog_scope": "authoring",
  "title": "AI 客服：从信号到交接",
  "audience": "产品负责人、客服运营、解决方案架构师与研发团队",
  "purpose": "用五种系统式页面补齐路径、数据、信号、概念界面和空间表达",
  "page_count": 5,
  "central_message": "可治理的服务需要让关系路径、状态和交接都能被看见。",
  "narrative": {
    "opening": "观众先进入一个具体的服务现场。",
    "problem": "如果上下文、判断或交接被切断，下一步就要重新开始。",
    "insight": "连续服务需要让关系、动作和现场线索保持可见。",
    "method": "用一个页面职责承载一个清楚的关系，再把不同职责串成完整叙事。",
    "action": "先把最常发生的一段服务关系接起来。"
  },
  "language": "zh-CN",
  "canvas": "16:9",
  "theme_ref": "systems/white-cyan-circuit",
  "slides": [
    {
      "id": "s01",
      "role": "process",
      "purpose": "展示请求沿系统路径前进",
      "claim": "一条请求沿着信号路径向前",
      "exact_text": [
        "一条请求沿着信号路径向前",
        "接入",
        "判断",
        "调用",
        "交接"
      ],
      "evidence": [],
      "visual_brief": "白底青蓝技术场中，一条连续线路经过四个无编号节点；方向清楚、节点稀疏，不添加伪指标或 UI 卡片。",
      "visual_scheme_ref": "systems/white-cyan-circuit/circuit-flow",
      "visual_anchor_id": "connection-node",
      "continuity_group": "request-path",
      "layout_plan": {
        "text_safe_zone": "top-left",
        "visual_zone": [
          "center",
          "right"
        ],
        "hierarchy": [
          "headline",
          "relationship-paths",
          "stages"
        ],
        "density": "medium"
      },
      "transition": "从路径进入可见状态"
    },
    {
      "id": "s02",
      "role": "data",
      "purpose": "把服务关系拆成可观察的状态",
      "claim": "运营治理需要看见每一段关系",
      "exact_text": [
        "运营治理需要看见每一段关系",
        "请求",
        "上下文",
        "动作",
        "结果"
      ],
      "evidence": [],
      "visual_brief": "浅色技术场中的四段状态关系，以环形或分组图形表达，不生成数字、单位或未经提供的指标。",
      "visual_scheme_ref": "systems/white-cyan-circuit/data-overview",
      "visual_anchor_id": "blueprint-ring",
      "continuity_group": "request-path",
      "layout_plan": {
        "text_safe_zone": "top-left",
        "visual_zone": [
          "center",
          "right"
        ],
        "hierarchy": [
          "headline",
          "data-groups",
          "relationship-paths"
        ],
        "density": "medium"
      },
      "transition": "从状态进入系统判断"
    },
    {
      "id": "s03",
      "role": "quote",
      "purpose": "用单条判断停留在治理原则",
      "claim": "系统的价值，是让下一步有依据",
      "exact_text": [
        "系统的价值，是让下一步有依据",
        "看见关系，再决定动作"
      ],
      "evidence": [],
      "visual_brief": "白色安静场中只有一条青蓝信号和少量节点，文字位于左侧安全区，不补写作者、出处或技术术语。",
      "visual_scheme_ref": "systems/white-cyan-circuit/signal-quote",
      "visual_anchor_id": "calibration-line",
      "continuity_group": "request-path",
      "layout_plan": {
        "text_safe_zone": "left",
        "visual_zone": [
          "right"
        ],
        "hierarchy": [
          "statement",
          "signal-anchor",
          "supporting-line"
        ],
        "density": "low"
      },
      "transition": "从原则进入概念界面"
    },
    {
      "id": "s04",
      "role": "image-hero",
      "purpose": "展示关系优先的概念界面",
      "claim": "先让概念界面服务于关系",
      "exact_text": [
        "先让概念界面服务于关系",
        "上下文先到"
      ],
      "evidence": [],
      "visual_brief": "概念化而非真实产品的浅色界面示意：一个关系主视图、少量节点和安静文字区；不出现品牌、按钮文案或伪数据。",
      "visual_scheme_ref": "systems/white-cyan-circuit/ui-concept",
      "visual_anchor_id": "blueprint-ring",
      "continuity_group": "request-path",
      "layout_plan": {
        "text_safe_zone": "top-left",
        "visual_zone": [
          "center",
          "right"
        ],
        "hierarchy": [
          "caption",
          "interface-anchor",
          "supporting-line"
        ],
        "density": "medium"
      },
      "transition": "从局部界面进入整体空间"
    },
    {
      "id": "s05",
      "role": "image-hero",
      "purpose": "用等距空间收束系统的整体尺度",
      "claim": "复杂服务也可以拥有清楚的空间",
      "exact_text": [
        "复杂服务也可以拥有清楚的空间",
        "从入口到交接"
      ],
      "evidence": [],
      "visual_brief": "白底等距技术空间：入口、知识、动作和交接用简洁几何体连接，保持工程图示感，不使用暗黑霓虹或设备广告。",
      "visual_scheme_ref": "systems/white-cyan-circuit/isometric-space",
      "visual_anchor_id": "blueprint-ring",
      "continuity_group": "request-path",
      "layout_plan": {
        "text_safe_zone": "top-left",
        "visual_zone": [
          "center",
          "right"
        ],
        "hierarchy": [
          "headline",
          "spatial-anchor",
          "short-caption"
        ],
        "density": "low"
      },
      "transition": "结束"
    }
  ],
  "mode": "imagegen",
  "output_mode": "full-slide-image",
  "approved_at": "2026-08-15T19:40:14.818Z"
}
