{
  "schema_version": 3,
  "status": "approved",
  "catalog_scope": "authoring",
  "title": "主题架构视觉冒烟测试",
  "audience": "StoryWeave 主题设计与实现维护者",
  "purpose": "比较相同内容在两套候选主题样式中的视觉差异",
  "page_count": 4,
  "central_message": "主题样式应在保持内容不变的前提下，形成可辨识且可复用的视觉语言。",
  "narrative": {
    "opening": "先用同一份内容排除文案差异。",
    "problem": "单张封面无法判断主题能否处理不同页面职责。",
    "insight": "封面、观点和两种标题层级的流程页可以覆盖最明显的主题差异。",
    "method": "两套候选主题分别生成四页，并逐项比较。",
    "action": "根据实际成图决定哪些方案进入首批实现。"
  },
  "language": "zh-CN",
  "canvas": "16:9",
  "theme_ref": "systems/white-cyan-circuit",
  "slides": [
    {
      "id": "c01",
      "role": "cover",
      "purpose": "检查主题的第一眼识别和标题层级",
      "claim": "让上下文持续产生价值",
      "exact_text": ["AI 原生知识工作流", "让上下文持续产生价值"],
      "evidence": [],
      "visual_brief": "白色技术空间中的发布封面，以单一青蓝连接节点和短校准线建立焦点，不出现界面、数据或额外文字。",
      "visual_scheme_ref": "systems/white-cyan-circuit/keynote-cover",
      "visual_anchor_id": "calibration-line",
      "continuity_group": "cover",
      "layout_plan": {"text_safe_zone": "top-left", "visual_zone": ["center", "right", "bottom-right"], "hierarchy": ["headline", "subtitle", "visual-anchor"], "density": "low"},
      "transition": "从封面进入问题判断",
      "sources": [{"type": "approved-example", "path": "skills/storyweave-imagegen/assets/examples/storyweave-imagegen-demo/deck_spec.json", "slide_id": "s01"}]
    },
    {
      "id": "c02",
      "role": "statement",
      "purpose": "检查低密度观点页的文字控制和留白",
      "claim": "信息很多，上下文却在丢失",
      "exact_text": ["信息很多，上下文却在丢失", "资料散落", "判断失联", "行动断点"],
      "evidence": [],
      "visual_brief": "三个断开的青蓝信号节点表示资料、判断和行动失联，主标题保持克制，不生成界面或额外标签。",
      "visual_scheme_ref": "systems/white-cyan-circuit/signal-quote",
      "visual_anchor_id": "calibration-line",
      "continuity_group": "main",
      "layout_plan": {"text_safe_zone": "left", "visual_zone": ["center", "right"], "hierarchy": ["headline", "three-short-lines", "visual-anchor"], "density": "low"},
      "transition": "从问题进入处理方法",
      "sources": [{"type": "approved-example", "path": "skills/storyweave-imagegen/assets/examples/storyweave-imagegen-demo/deck_spec.json", "slide_id": "s02"}]
    },
    {
      "id": "c03",
      "role": "process",
      "purpose": "检查青蓝电路路径能否清楚表达闭环",
      "claim": "四个动作构成闭环",
      "exact_text": ["四个动作构成闭环", "收集现场", "建立关联", "形成判断", "推进行动"],
      "evidence": [],
      "visual_brief": "四个青蓝节点沿一条连续电路路径形成闭环，方向明确，避免卡片矩阵、编号和额外说明。",
      "visual_scheme_ref": "systems/white-cyan-circuit/circuit-flow",
      "visual_anchor_id": "connection-node",
      "continuity_group": "main",
      "layout_plan": {"text_safe_zone": "top", "visual_zone": ["left", "center", "right", "bottom"], "hierarchy": ["headline", "four-stages", "directional-path"], "density": "medium"},
      "transition": "对照图形主导的同内容变体",
      "sources": [{"type": "approved-example", "path": "skills/storyweave-imagegen/assets/examples/storyweave-imagegen-demo/deck_spec.json", "slide_id": "s04"}]
    },
    {
      "id": "c04",
      "role": "process",
      "purpose": "检查页面不使用超大标题时，青蓝路径能否独立传达闭环关系",
      "claim": "四个动作构成闭环",
      "exact_text": ["四个动作构成闭环", "收集现场", "建立关联", "形成判断", "推进行动"],
      "evidence": [],
      "visual_brief": "四个动作和连续信号路径占据页面主体；主张只作为小型校准说明，不占据标题横幅，也不与阶段名称争夺第一视觉层级。",
      "visual_scheme_ref": "systems/white-cyan-circuit/circuit-flow",
      "visual_anchor_id": "connection-node",
      "continuity_group": "main",
      "layout_plan": {"text_safe_zone": "top-left", "visual_zone": ["left", "center", "right", "bottom"], "hierarchy": ["four-stages", "directional-path", "claim-label"], "density": "medium"},
      "transition": "结束测试样例",
      "sources": [{"type": "approved-example", "path": "skills/storyweave-imagegen/assets/examples/storyweave-imagegen-demo/deck_spec.json", "slide_id": "s04"}]
    }
  ],
  "mode": "imagegen",
  "output_mode": "full-slide-image",
  "approved_at": "2026-08-15T09:43:20Z"
}
