{
  "schema_version": 3,
  "status": "approved",
  "catalog_scope": "authoring",
  "title": "AI 客服发布：让下一步被看见",
  "audience": "产品市场团队、业务负责人和客户体验团队",
  "purpose": "用三种传播式页面补齐动作路径、定性数据和传播判断",
  "page_count": 3,
  "central_message": "传播画面应让服务动作清楚，而不是替服务制造承诺。",
  "narrative": {
    "opening": "观众先进入一个具体的服务现场。",
    "problem": "如果上下文、判断或交接被切断，下一步就要重新开始。",
    "insight": "连续服务需要让关系、动作和现场线索保持可见。",
    "method": "用一个页面职责承载一个清楚的关系，再把不同职责串成完整叙事。",
    "action": "先把最常发生的一段服务关系接起来。"
  },
  "language": "zh-CN",
  "canvas": "16:9",
  "theme_ref": "campaign/bold-poster",
  "slides": [
    {
      "id": "s01",
      "role": "process",
      "purpose": "用一条平面路径表达动作推进",
      "claim": "一次提问，沿着一条路径走向行动",
      "exact_text": [
        "一次提问，沿着一条路径走向行动",
        "提问",
        "判断",
        "行动"
      ],
      "evidence": [],
      "visual_brief": "高对比平面色场中，一条红蓝路径从提问经过判断后指向行动；阶段不编号，文字只来自清单。",
      "visual_scheme_ref": "campaign/bold-poster/campaign-flow",
      "visual_anchor_id": "color-block",
      "continuity_group": "launch-steps",
      "layout_plan": {
        "text_safe_zone": "top-left",
        "visual_zone": [
          "center",
          "right"
        ],
        "hierarchy": [
          "headline",
          "action-path",
          "supporting-line"
        ],
        "density": "medium"
      },
      "transition": "从路径进入定性信号"
    },
    {
      "id": "s02",
      "role": "data",
      "purpose": "用少量定性信息支持传播判断",
      "claim": "传播要让下一步看得见",
      "exact_text": [
        "传播要让下一步看得见",
        "理解",
        "选择",
        "继续"
      ],
      "evidence": [],
      "visual_brief": "海报式定性图形：三个等重色块或环形段落表现理解、选择和继续，不添加数字、百分比、价格或品牌标志。",
      "visual_scheme_ref": "campaign/bold-poster/campaign-data",
      "visual_anchor_id": "color-block",
      "continuity_group": "launch-steps",
      "layout_plan": {
        "text_safe_zone": "top-left",
        "visual_zone": [
          "center",
          "right"
        ],
        "hierarchy": [
          "headline",
          "data-shape",
          "supporting-line"
        ],
        "density": "medium"
      },
      "transition": "从定性信息进入传播判断"
    },
    {
      "id": "s03",
      "role": "quote",
      "purpose": "用一句克制的传播判断结束覆盖",
      "claim": "好的传播，不替服务做承诺",
      "exact_text": [
        "好的传播，不替服务做承诺",
        "让下一步自然发生"
      ],
      "evidence": [],
      "visual_brief": "单一传播标记和安静色块承载两行判断，文字不叠在高光或主体上，不添加 CTA、Logo 或广告副文案。",
      "visual_scheme_ref": "campaign/bold-poster/campaign-signal",
      "visual_anchor_id": "campaign-mark",
      "continuity_group": "launch-steps",
      "layout_plan": {
        "text_safe_zone": "left",
        "visual_zone": [
          "right"
        ],
        "hierarchy": [
          "statement",
          "campaign-mark",
          "supporting-line"
        ],
        "density": "low"
      },
      "transition": "结束"
    }
  ],
  "mode": "imagegen",
  "output_mode": "full-slide-image",
  "approved_at": "2026-08-15T19:40:14.994Z"
}
