{
  "schema_version": 3,
  "status": "approved",
  "catalog_scope": "authoring",
  "title": "客服体验：从一次回答到一段连续关系",
  "audience": "客户体验负责人、产品团队与客服运营团队",
  "purpose": "用编辑叙事说明 AI 客服如何把一次咨询转化为连续的服务关系",
  "page_count": 3,
  "central_message": "客服体验的价值不在于更快结束对话，而在于让下一步自然发生。",
  "narrative": {
    "opening": "用户带着一个具体问题进入服务现场。",
    "problem": "如果每一步都从零开始，用户必须重复说明已经发生的事。",
    "insight": "连续的上下文让一次回答变成可继续的关系。",
    "method": "从听见问题、理解上下文到给出行动并留下反馈。",
    "action": "先把一条高频服务旅程连起来。"
  },
  "language": "zh-CN",
  "canvas": "16:9",
  "theme_ref": "editorial/paper-magazine",
  "slides": [
    {
      "id": "s01",
      "role": "cover",
      "purpose": "建立客服体验的编辑视角",
      "claim": "客服体验从一次回答变成一段可连续的关系",
      "exact_text": [
        "客服体验从一次回答变成一段可连续的关系",
        "从问题现场开始"
      ],
      "evidence": [],
      "visual_brief": "纸面杂志式开场：一个安静的服务现场被裁切成主体，主张落在留白纸面，暗示关系会继续向前。",
      "visual_scheme_ref": "editorial/paper-magazine/magazine-cover",
      "visual_anchor_id": "paper-crop",
      "continuity_group": "cover",
      "layout_plan": {
        "text_safe_zone": "top-left",
        "visual_zone": [
          "center",
          "right"
        ],
        "hierarchy": [
          "headline",
          "visual-anchor",
          "short-caption"
        ],
        "density": "low"
      },
      "transition": "从现场进入服务判断"
    },
    {
      "id": "s02",
      "role": "process",
      "purpose": "说明连续服务如何形成",
      "claim": "把一次咨询拆成可复用的服务判断",
      "exact_text": [
        "把一次咨询拆成可复用的服务判断",
        "听见问题",
        "理解上下文",
        "给出行动",
        "留下反馈"
      ],
      "evidence": [],
      "visual_brief": "纸面图解用墨线和有限色块把四个动作串成一条有方向的服务路径，保持出版物留白，不使用卡片仪表盘。",
      "visual_scheme_ref": "editorial/paper-magazine/editorial-diagram",
      "visual_anchor_id": "ink-dot",
      "continuity_group": "service-journey",
      "layout_plan": {
        "text_safe_zone": "top-left",
        "visual_zone": [
          "center",
          "right"
        ],
        "hierarchy": [
          "headline",
          "relationship-paths",
          "four-stages"
        ],
        "density": "medium"
      },
      "transition": "从方法回到用户感受"
    },
    {
      "id": "s03",
      "role": "quote",
      "purpose": "收束用户体验判断",
      "claim": "好的客服不是更快结束，而是让用户少走一步",
      "exact_text": [
        "好的客服不是更快结束，而是让用户少走一步",
        "少一次重复说明"
      ],
      "evidence": [],
      "visual_brief": "低密度编辑判断页：纸面留白与一条细红线形成停留，视觉不引入人物姓名或额外出处。",
      "visual_scheme_ref": "editorial/paper-magazine/editorial-statement",
      "visual_anchor_id": "oxide-rule",
      "continuity_group": "service-journey",
      "layout_plan": {
        "text_safe_zone": "left",
        "visual_zone": [
          "right"
        ],
        "hierarchy": [
          "statement",
          "supporting-line",
          "visual-anchor"
        ],
        "density": "low"
      },
      "transition": "结束"
    }
  ],
  "mode": "imagegen",
  "output_mode": "full-slide-image",
  "approved_at": "2026-08-15T16:22:36.744Z"
}
